{
  "debtIndicator": 1,
  "bankData": {
    "sortCode": "11-22-33",
    "bankAccountNumber": "987654321123456789",
    "accountHolderName": "MR JOHN DOE O'MALLEY & MRS O'MALLEY",
    "validFromDate": "1981-01-01"
  },
  "awardInformation": [
    {
      "awardValue": 0.00,
      "startDate": "2010-12-31",
      "endDate": "2018-12-30"
    },
    {
      "awardValue": 45.00,
      "startDate": "2018-12-31",
      "endDate": "2028-12-30"
    }
  ],
  "rateInformation": {
    "higherRateValue": 99999999999.99,
    "standardRateValue": 0.0,
    "guardianAllowanceRateValue": 123456.78
  },
  "paymentData": [
    {
      "amount": -111.11,
      "dateFrom": "2010-12-31",
      "dateTo": "2011-01-30",
      "chargeRef": "A-131234/35",
      "expectedCreditingDate": "2010-02-03",
      "returnIndicator": 0
    },
    {
      "amount": 222.22,
      "dateFrom": "2010-12-31",
      "dateTo": "2011-01-30",
      "chargeRef": "A-131234/35",
      "expectedCreditingDate": "2010-02-03",
      "returnIndicator": 0
    }
  ],
  "adjustmentType": [
    {
      "adjustmentAmount": 666666.66,
      "adjustmentStartDate": "2012-07-07",
      "adjustmentEndDate": "2013-02-28",
      "adjustmentReasonCode": "10"
    },
    {
      "adjustmentAmount": 444444.44,
      "adjustmentStartDate": "2013-03-01",
      "adjustmentEndDate": "2013-11-01",
      "adjustmentReasonCode": "10"
    }
  ]
}